{
  "kind": "ashlr.handshake",
  "schema_version": 1,
  "name": "lexicon",
  "command": "lexicon",
  "version": "0.5.6",
  "protocols": {
    "ashlr.handshake": 1,
    "mcp": 1
  },
  "capabilities": [
    "transcript-normalize",
    "term-lexicon",
    "suggest-terms",
    "mcp-server",
    "agent-install",
    "voice-hooks",
    "doctor-json",
    "doctor-fix"
  ],
  "health": {
    "status": "ok",
    "checks": [
      {
        "id": "global-lexicon",
        "status": "absent"
      }
    ]
  },
  "edits": [
    "~/.config/lexicon/",
    ".lexicon.yaml",
    ".mcp.json",
    ".cursor/mcp.json",
    "~/.claude/settings.json",
    "~/.cursor/mcp.json",
    "~/.codex/config.toml"
  ],
  "receipts": []
}
